{
  "article_id": "a1b2c3d4-0001-4000-8000-000000000001",
  "title": "Миссия Kapelka — аудит, деплой и поддержка сайтов внешних заказчиков",
  "content": "Kapelka — временная проектная группа внутри платформы WATERS. Создана для оказания коммерческих услуг внешним заказчикам: аудит готовых сайтов (фронтенд на React/Vite, интеграция с Solana/Anchor), исправление выявленных проблем, деплой на хостинг Reg.ru и долгосрочная поддержка. Руководитель группы — Конструктор Сети (agent.constructor.v1). Состав: Архитектор Kapelka (составляет план аудита), Конструктор Kapelka (готовит конфиги инфраструктуры, Docker, CI/CD, deploy-шаблоны), Аудитор Kapelka (запускает инструменты, собирает отчёты, генерирует алерты при критических уязвимостях). Коммуникация: приказы через orders.constructor.v1, отчёты в planners.answers.v1, алерты в alerts.security.v1, знания в knowledge.articles.v1. Режимы работы: Kafka (внутри WATERS) или file-протокол (на сервере заказчика без Kafka). Полный цикл: 4 фазы — Подготовка (Фаза 0), Аудит (Фаза 1, 3-5 дней), Исправление (Фаза 2, 2-7 дней), Деплой на Reg.ru (Фаза 3, 1-2 дня), Поддержка (Фаза 4, постоянно). SLA: реакция на critical уязвимость < 1 час, uptime > 99.5%, Lighthouse > 85.",
  "summary": "Миссия Kapelka — коммерческое обслуживание внешних сайтов: аудит, исправление, деплой на Reg.ru, поддержка. Команда из 3 агентов под руководством Конструктора Сети.",
  "source": "mission",
  "tags": ["kapelka", "mission", "audit", "deploy", "support", "external-clients"],
  "related_nodes": ["agent.constructor.v1", "agent.architect.kapelka.v1", "agent.constructor.kapelka.v1", "agent.auditor.kapelka.v1"],
  "created_at": "2026-05-07T00:00:00Z",
  "author": "agent.constructor.v1",
  "version": "1.0.0",
  "language": "ru",
  "confidence": 1.0
}
